Ref,Study,Dataset,Method,Accuracy,MacroF1,Notes
[2],Arreche et al. (2024),CICIDS-2017,Two-level ensemble (boosting+bagging),1.000,,"VERIFIED from PDF (IEEE Access doi:10.1109/ACCESS.2024.3413415); best result Level 01 prediction probabilities all features — XGB/LGBM/Bag_DT/Bag_lgbm all achieve Acc=1.000 F1=1.000 (their Table 15); 7-class CICIDS-2017 (Normal/DoS/PortScan/BruteForce/WebAttack/Bot/Infiltration) vs our 15-class; F1 is weighted/overall not macro; not directly comparable"
[3],Arreche et al. (2024),CICIDS-2017,XAI-IDS — best of 7 black-box models (ADA),0.990,,"VERIFIED from PDF (Applied Sciences 14(10) 4170 doi:10.3390/app14104170); best result ADA top 15 features Acc=0.99 F1=0.99 (their Table 7); 7-class CICIDS-2017 vs our 15-class; F1 is weighted/overall not macro; not directly comparable"
[1],Al-Omari & Al-Haija (2024),CICIDS-2017,—,N/A,N/A,DATASET MISMATCH: paper uses UNSW-NB15 only — no CICIDS-2017 results (verified from paper PDF); see UNSW table row
[9],Fitni & Ramli (2020),CICIDS-2017,—,N/A,N/A,DATASET MISMATCH: paper uses CSE-CIC-IDS2018 (not CICIDS-2017) — verified from PDF abstract; reported acc=0.988 F1=0.979 are for CIC-IDS2018 and cannot be used here
ours,This work,CICIDS-2017,Diversity-driven stacking (CB+ET+EBM) + per-class thresholds,0.9983,0.8982,"5-fold CV; leak-proof pipeline; wF1=0.9984, MCC=0.9951; multi-class (15 traffic categories); macro-F1 penalises all minority classes equally — lower than competitor weighted F1 due to harder 15-class problem"
